{
  "schema": "icefarm-scenario-v1",
  "id": "S40-full-newgen-engagement",
  "shape": "S'C'F'",
  "images": {
    "new": "p50s4-diag-b269fad9"
  },
  "instances": [
    {
      "name": "S1",
      "role": "S",
      "host": "tt-quietbox3",
      "image": "new",
      "env": {"ICECC_P50_PROFILE": "P29V1"}
    },
    {
      "name": "F1",
      "role": "F",
      "system_source_snapshot": "stable-f-source",
      "host": "tt-quietbox3",
      "image": "new",
      "slots": 24
    },
    {
      "name": "F2",
      "role": "F",
      "system_source_snapshot": "stable-f-source",
      "host": "tt-quietbox5",
      "image": "new",
      "slots": 12
    },
    {
      "name": "C1",
      "role": "C",
      "host": "tt-quietbox2",
      "image": "new",
      "client_environment": "fedora-clang-libcxx",
      "system_source_snapshot": "stable-f-source",
      "env": {"ICECC_P50_MODE": "on"}
    }
  ],
  "workload": {
    "driver": "tu-manifest",
    "corpus": "firefox-1000",
    "turns": ["A", "B"],
    "jobs": 48,
    "clients": ["C1"],
    "repeat": 1,
    "oracle": "local-sha"
  },
  "network": {"shaping": []},
  "timeline": [
    {
      "trigger": "job 24",
      "action": "header_edit",
      "instance": "F2",
      "path": "/usr/include/stdio.h"
    }
  ],
  "expect": {
    "exact": "all",
    "engagement": "expected(c,f)",
    "wedges": 0,
    "error106_max": 0,
    "tail_to_incapable": 0,
    "reuse": "all-true-when-p29v1",
    "reuse_pairs": {"C1/F1": true, "C1/F2": false},
    "wall_s_max": null
  },
  "controls": [],
  "timeouts": {
    "images_s": 1800,
    "up_s": 300,
    "turn_s": 1800,
    "collect_s": 600,
    "down_s": 300
  }
}
