{
  "schema": "icefarm-scenario-v1",
  "id": "S70-b4-client-route-restart",
  "shape": "S'C'F'",
  "images": {
    "new": "p50s4-01cbd11b"
  },
  "instances": [
    {
      "name": "S1",
      "role": "S",
      "host": "tt-quietbox3",
      "image": "new",
      "env": {
        "ICECC_P50_PROFILE": "P29V1"
      }
    },
    {
      "name": "F1",
      "role": "F",
      "host": "tt-quietbox5",
      "image": "new",
      "slots": 24
    },
    {
      "name": "C1",
      "role": "C",
      "host": "tt-quietbox2",
      "image": "new",
      "client_environment": "debian-gcc",
      "env": {
        "ICECC_P50_MODE": "on"
      }
    }
  ],
  "workload": {
    "driver": "tu-manifest",
    "corpus": "fmt-100",
    "turns": [
      "A"
    ],
    "jobs": 1,
    "clients": [
      "C1"
    ],
    "repeat": 1,
    "oracle": "local-sha"
  },
  "network": {
    "shaping": []
  },
  "timeline": [
    {
      "trigger": "job 75",
      "action": "restart",
      "instance": "C1"
    }
  ],
  "expect": {
    "exact": "all",
    "engagement": "s70-b4-client-route-restart",
    "wedges": 0,
    "error106_max": 0,
    "tail_to_incapable": 0,
    "reuse": "none-when-legacy",
    "wall_s_max": null
  },
  "controls": [],
  "timeouts": {
    "images_s": 1800,
    "up_s": 300,
    "turn_s": 1800,
    "collect_s": 600,
    "down_s": 300
  }
}
