{
  "schema": "icefarm-scenario-v1",
  "id": "S50-all-f-new-mixed-c",
  "shape": "mixed",
  "images": {"old": "p43-1.4.0", "new": "p50s4-1374a980"},
  "instances": [
    {"name": "S1", "role": "S", "host": "tt-quietbox3", "image": "new", "env": {"ICECC_P50_PROFILE": "P29V1"}},
    {"name": "F1", "role": "F", "host": "tt-quietbox2", "image": "new", "slots": 4},
    {"name": "F2", "role": "F", "host": "tt-quietbox2", "image": "new", "slots": 4},
    {"name": "F3", "role": "F", "host": "tt-quietbox2", "image": "new", "slots": 4},
    {"name": "F4", "role": "F", "host": "tt-quietbox3", "image": "new", "slots": 4},
    {"name": "F5", "role": "F", "host": "tt-quietbox2", "image": "new", "slots": 4},
    {"name": "F6", "role": "F", "host": "tt-quietbox3", "image": "new", "slots": 4},
    {"name": "F7", "role": "F", "host": "tt-quietbox3", "image": "new", "slots": 4},
    {"name": "F8", "role": "F", "host": "tt-quietbox3", "image": "new", "slots": 4},
    {"name": "F9", "role": "F", "host": "tt-quietbox3", "image": "new", "slots": 4},
    {"name": "C1", "role": "C", "host": "tt-quietbox2", "image": "old", "client_environment": "debian-gcc"},
    {"name": "C2", "role": "C", "host": "tt-quietbox3", "image": "new", "client_environment": "debian-gcc", "env": {"ICECC_P50_MODE": "on"}}
  ],
  "workload": {"driver": "tu-manifest", "corpus": "fmt-100", "turns": ["A"], "jobs": 100, "clients": ["C1", "C2"], "repeat": 1, "oracle": "local-sha"},
  "network": {"shaping": []},
  "timeline": [],
  "expect": {"exact": "all", "engagement": "expected(c,f)", "wedges": 0, "error106_max": 0, "tail_to_incapable": 0, "reuse": "all-false-when-p29v1", "wall_s_max": null},
  "controls": [],
  "timeouts": {"images_s": 1800, "up_s": 300, "turn_s": 1800, "collect_s": 600, "down_s": 300}
}
