{
  "schema": "icefarm-scenario-v1",
  "id": "H1-role-hash-refusal",
  "shape": "S'C'F'",
  "images": {
    "wrong": "p50s2-5b2e5801"
  },
  "instances": [
    {
      "name": "S1",
      "role": "S",
      "host": "tt-quietbox3",
      "image": "wrong",
      "env": {
        "ICECC_P50_PROFILE": "P29V1"
      }
    },
    {
      "name": "F1",
      "role": "F",
      "host": "tt-quietbox2",
      "image": "wrong",
      "slots": 24
    },
    {
      "name": "C1",
      "role": "C",
      "host": "tt-quietbox3",
      "image": "wrong",
      "client_environment": "debian-gcc",
      "env": {
        "ICECC_P50_MODE": "on"
      }
    }
  ],
  "workload": {
    "driver": "tu-manifest",
    "corpus": "fmt-100",
    "turns": [
      "A"
    ],
    "jobs": 1,
    "clients": [
      "C1"
    ],
    "repeat": 1,
    "oracle": "local-sha"
  },
  "network": {
    "shaping": []
  },
  "timeline": [],
  "expect": {
    "exact": "all",
    "engagement": "expected(c,f)",
    "wedges": 0,
    "error106_max": 0,
    "tail_to_incapable": 0,
    "reuse": "all-false-when-p29v1",
    "wall_s_max": null
  },
  "controls": [
    "H1"
  ],
  "timeouts": {
    "images_s": 1800,
    "up_s": 300,
    "turn_s": 1800,
    "collect_s": 600,
    "down_s": 300
  }
}
