{
  "schema": "icefarm-scenario-v1",
  "id": "S90-revision-refusal-retry",
  "shape": "S'[F~][C']",
  "images": {
    "new": "p50s4-01cbd11b",
    "mutant": "p50s90-f-hidden-skew-f9648cc1"
  },
  "instances": [
    {
      "name": "S1",
      "role": "S",
      "host": "tt-quietbox3",
      "image": "new",
      "env": {"ICECC_P50_PROFILE": "P29V1"}
    },
    {
      "name": "F1",
      "role": "F",
      "host": "tt-quietbox2",
      "image": "mutant",
      "slots": 1,
      "env": {"ICECC_P50_S90_ENDPOINT_WIRE_REVISION": "2"}
    },
    {
      "name": "C1",
      "role": "C",
      "host": "tt-quietbox3",
      "image": "new",
      "client_environment": "debian-gcc",
      "env": {"ICECC_P50_MODE": "on"}
    }
  ],
  "workload": {
    "driver": "tu-manifest",
    "corpus": "fmt-100",
    "turns": ["A"],
    "jobs": 1,
    "clients": ["C1"],
    "repeat": 1,
    "oracle": "local-sha"
  },
  "network": {"shaping": []},
  "timeline": [],
  "expect": {
    "exact": "all",
    "engagement": "s90-revision-refusal-retry",
    "wedges": 0,
    "error106_max": 100,
    "tail_to_incapable": 0,
    "reuse": "none-when-legacy",
    "wall_s_max": null
  },
  "controls": [],
  "timeouts": {
    "images_s": 1800,
    "up_s": 300,
    "turn_s": 600,
    "collect_s": 600,
    "down_s": 300
  }
}
